{
  "v": 1,
  "listVersion": "20261016-0200",
  "listHash": "43b32a22bf784accc75a5bdcd258e737be48c207b8785269b041eb42b02457e2",
  "publishedAt": "2026-10-16T02:14:07.120Z",
  "entryCount": 5002,
  "format": "hokeka.sanctions.jsonl.gzip.v1",
  "chunks": [
    {
      "index": 0,
      "sha256": "d6edfdc3fbd337ae29197aa9dccba4af4c7a1ec9f193597b5026170f96a6be60",
      "entryCount": 2,
      "bytes": 170
    },
    {
      "index": 1,
      "sha256": "2d711642b726b04401627ca9fbac32f5c8530fb1903cc4db02258717921a4881",
      "entryCount": 5000,
      "bytes": 180344
    }
  ]
}
